<?xml version="1.0" encoding="UTF-8"?>
<quest_scripts xmlns:xsi="http://www.w3.org/2001/XMLSchema-instance" xsi:noNamespaceSchemaLocation="quest_script_data.xsd">
<!--
    Quest Poeta
	Make By (Encom)
 -->
	<!-- Sleeping On The Job (Elyos Only) -->
	<report_to id="1101" start_npc_ids="203049" end_npc_ids="203057"/>
	<!-- Report To Polina (Elyos Only) -->
	<report_to id="1104" start_npc_ids="203057" end_npc_ids="203059"/>
	<report_to_many id="1118" start_npc_ids="203059"  end_npc_ids="203079">
		<npc_infos var="0" npc_id="203070" quest_dialog="1352"/>
		<npc_infos var="1" npc_id="203079" quest_dialog="2375" close_dialog="1009"/>
	</report_to_many>
	<!-- Helping Kales (Elyos Only) -->
	<report_to id="1106" start_npc_ids="203050" end_npc_ids="203061" item_id="182200203"/>
	<!-- A Book For Namus (Elyos Only) -->
	<report_to id="1110" start_npc_ids="203065" end_npc_ids="203075" item_id="182200206"/>
	<!-- A Taste Of Namus's Medicine (Elyos Only) -->
	<report_to id="1119" start_npc_ids="203075" end_npc_ids="203080" item_id="182200225"/>
	
	<!-- The Snuffler Headache (Elyos Only) -->
	<item_collecting id="1105" start_npc_ids="203050" />
	<!-- Pernos's Robe (Elyos Only) -->
	<item_collecting id="1116" start_npc_ids="203060"/>
	<!-- Light Up The Night (Elyos Only) -->
	<item_collecting id="1117" start_npc_ids="203074"/>
	<!-- Oz's Prayer Beads (Elyos Only) -->
	<item_collecting id="1121" start_npc_ids="203081" end_npc_ids="203081" start_dialog_id2="2375"/>
	<!-- Avenging Tutty (Elyos Only) -->
	<item_collecting id="1124" start_npc_ids="790001"/>
	<!-- Mushroom Research (Elyos Only) -->
	<item_collecting id="1126" start_npc_ids="203079"/>
	<!-- Collecting Aria (Elyos Only) -->
	<item_collecting id="1206" start_npc_ids="203059"/>
	<!-- Uno's Ingredients (Elyos Only) -->
	<item_collecting id="1108" start_npc_ids="203061" end_npc_ids="203072"/>
	<!-- Scouting Timolia Mine (Elyos Only) -->
	<item_collecting id="1129" start_npc_ids="203085" end_npc_ids="203067"/>
	<!-- Tula's Music Box (Elyos Only) -->
	<item_collecting id="1207" start_npc_ids="203082" end_npc_ids="203085"/>
	<!-- Grain Thieves (Elyos Only) -->
	<item_collecting id="1103" start_npc_ids="203057" action_item_ids="700105"/>
	<!-- Abandoned Goods (Elyos Only) -->
	<item_collecting id="1109" start_npc_ids="798007" action_item_ids="700106"/>
	<!-- Suspicious Ore (Elyos Only) -->
	<item_collecting id="1125" start_npc_ids="203085" end_npc_ids="203067" action_item_ids="700107"/>
	
	<!-- Kerubar Hunt (Elyos Only) -->
	<monster_hunt id="1102" start_npc_ids="203057">
		<monster npc_ids="210133 210134" var="0" end_var="3"/>
	</monster_hunt>
	<!-- To Fish In Peace (Elyos Only) -->
	<monster_hunt id="1112" start_npc_ids="203072">
		<monster npc_ids="210259 210260" var="0" end_var="5"/>
		<monster npc_ids="210065 210066" var="1" end_var="5"/>
	</monster_hunt>
	<!-- Mushroom Thieves (Elyos Only) -->
	<monster_hunt id="1113" start_npc_ids="203076">
		<monster npc_ids="210262 210675" var="0" end_var="8"/>
	</monster_hunt>
	<!-- Thinning Out Worgs (Elyos Only) -->
	<monster_hunt id="1120" start_npc_ids="203082">
		<monster npc_ids="210142 210143" var="0" end_var="9"/>
	</monster_hunt>
	
	<!-- The Elim's Message (Elyos Only) -->
	<xml_quest start_npc_id="203075" end_npc_id="203058" id="1115">
		<on_talk_event ids="203072 203058">
	    <var value="0">
	      <npc id="203072">
	        <dialog id="31">
	          <operations>
	            <npc_dialog id="1352"/>
	          </operations>
	        </dialog>
	        <dialog id="10000">
	          <operations>
	            <set_quest_var var_id="0" value="1"/>
	            <npc_dialog id="1352" quest_id="0"/>
	          </operations>
	        </dialog>
	      </npc>
	    </var>
	    <var value="1">
	      <npc id="203058">
	        <dialog id="31">
	          <operations>
	            <npc_dialog id="2375"/>
	          </operations>
	        </dialog>
	        <dialog id="1009">
	          <operations override="false">
	            <set_quest_status status="REWARD"/>
	          </operations>
	        </dialog>
	      </npc>
	    </var>
	  </on_talk_event>
	</xml_quest>
	<!-- Ancient Cube (Elyos Only) -->
	<xml_quest start_npc_id="798008" end_npc_id="798008" id="1127">
        <on_talk_event ids="700001">
            <var value="0">
                <npc id="700001">
                    <dialog id="-1">
                        <operations>
                            <give_item item_id="182200215" count="1"/>
                            <set_quest_var var_id="0" value="1"/>
                        </operations>
                    </dialog>
                </npc>
            </var>
            <var value="1">
                <npc id="798008">
                    <dialog id="31">
                        <operations>
                            <npc_dialog id="2375"/>
                        </operations>
                    </dialog>
                    <dialog id="39">
                        <operations>
                            <collect_items>
                                <true>
                                    <set_quest_status status="REWARD"/>
                                    <npc_dialog id="5"/>
                                </true>
                                <false>
                                    <npc_dialog id="2716"/>
                                </false>
                            </collect_items>
                        </operations>
                    </dialog>
                </npc>
            </var>
        </on_talk_event>
	</xml_quest>
</quest_scripts>