<?xml version="1.0" encoding="UTF-8"?>
<quest_scripts xmlns:xsi="http://www.w3.org/2001/XMLSchema-instance" xsi:noNamespaceSchemaLocation="quest_script_data.xsd">
<!--
    Quest Verteron Make By (Encom)
 -->
	<report_to id="1138" start_npc_ids="203110" end_npc_ids="203123"/>
	<report_to id="1140" start_npc_ids="203123" end_npc_ids="730001"/>
	<report_to id="1142" start_npc_ids="203133" end_npc_ids="203100" item_id="182203101"/>
	<report_to id="1147" start_npc_ids="203096" end_npc_ids="203126" item_id="182200520"/>
	<report_to id="1150" start_npc_ids="790000" end_npc_ids="203125"/>
	<report_to id="1153" start_npc_ids="203130" end_npc_ids="203150" item_id="182200527"/>
	<report_to id="1164" start_npc_ids="203131" end_npc_ids="203149" item_id="182200536"/>
	<report_to id="1165" start_npc_ids="203141" end_npc_ids="203163" item_id="182200537"/>
	<report_to id="1171" start_npc_ids="203103" end_npc_ids="203155" item_id="182200542"/>
	<report_to id="1180" start_npc_ids="203157" end_npc_ids="203178" item_id="182200548"/>
	<report_to id="1184" start_npc_ids="203165" end_npc_ids="203097"/>
	<report_to id="1188" start_npc_ids="203164" end_npc_ids="203167"/>
	<report_to id="1191" start_npc_ids="203099" end_npc_ids="203183" item_id="182200555"/>
	<report_to id="1199" start_npc_ids="203161" end_npc_ids="203893" item_id="182200560"/>
	<report_to id="1224" start_npc_ids="203110" end_npc_ids="203179"/>
	
	<item_collecting id="1132" start_npc_ids="203101" end_npc_ids="203097"/>
	<item_collecting id="1136" start_npc_ids="203100" action_item_ids="700116"/>
	<item_collecting id="1137" start_npc_ids="203111" action_item_ids="700108"/>
	<item_collecting id="1144" start_npc_ids="203130" action_item_ids="700109"/>
	<item_collecting id="1145" start_npc_ids="203124"/>
	<item_collecting id="1148" start_npc_ids="203154"/>
	<item_collecting id="1151" start_npc_ids="203125"/>
	<item_collecting id="1154" start_npc_ids="203150" end_npc_ids="203130" action_item_ids="700031 700032"/>
	<item_collecting id="1155" start_npc_ids="203126" action_item_ids="700117"/>
	<item_collecting id="1159" start_npc_ids="203151"/>
	<item_collecting id="1160" start_npc_ids="203127"/>
	<item_collecting id="1166" start_npc_ids="203148"/>
	<item_collecting id="1167" start_npc_ids="203162"/>
	<item_collecting id="1168" start_npc_ids="203163" action_item_ids="700114"/>
	<item_collecting id="1172" start_npc_ids="203110" end_npc_ids="203146" action_item_ids="700115"/>
	<item_collecting id="1174" start_npc_ids="203155"/>
	<item_collecting id="1176" start_npc_ids="203158"/>
	<item_collecting id="1177" start_npc_ids="203156" end_npc_ids="203157" action_item_ids="700006"/>
	<item_collecting id="1178" start_npc_ids="203155" action_item_ids="700113"/>
	<item_collecting id="1186" start_npc_ids="730012"/>
	<item_collecting id="1189" start_npc_ids="203166"/>
	<item_collecting id="1190" start_npc_ids="203183"/>
	<item_collecting id="1193" start_npc_ids="203098"/>
	<item_collecting id="1203" start_npc_ids="730012"/>
	<item_collecting id="1204" start_npc_ids="203166"/>
	<item_collecting id="1208" start_npc_ids="203137"/>
	<item_collecting id="1210" start_npc_ids="203157"/>
	<item_collecting id="1213" start_npc_ids="203153"/>
	<item_collecting id="1214" start_npc_ids="203153" end_npc_ids="203157"/>
	<item_collecting id="1215" start_npc_ids="203172"/>
	<item_collecting id="1219" start_npc_ids="203172" action_item_ids="700283"/>
	<item_collecting id="1225" start_npc_ids="203179"/>
	<item_collecting id="14110" start_npc_ids="203111"/>
	<item_collecting id="14113" start_npc_ids="203178"/>
	<item_collecting id="80002" start_npc_ids="799774"/>
	
	<monster_hunt id="1133" start_npc_ids="203096">
		<monster var="0" npc_ids="210264 210265" end_var="9"/>
		<monster var="0" npc_ids="" end_var="9"/>
	</monster_hunt>
	<monster_hunt id="1134" start_npc_ids="203102">
		<monster var="0" npc_ids="210203 210204" end_var="6"/>
		<monster var="1" npc_ids="210063 210064" end_var="6"/>
	</monster_hunt>
	<monster_hunt id="1135" start_npc_ids="203190">
		<monster var="0" npc_ids="210268" end_var="9"/>
	</monster_hunt>
	<monster_hunt id="1139" start_npc_ids="203124">
		<monster var="0" npc_ids="210138 210139" end_var="6"/>
		<monster var="1" npc_ids="210140 " end_var="4"/>
	</monster_hunt>
	<monster_hunt id="1143" start_npc_ids="730001">
		<monster var="0" npc_ids="210698 210077" end_var="10"/>
	</monster_hunt>
	<monster_hunt id="1173" start_npc_ids="203155">
		<monster var="0" npc_ids="210121 210122 210123" end_var="10"/>
	</monster_hunt>
	<monster_hunt id="1175" start_npc_ids="203156">
		<monster var="0" npc_ids="210344" end_var="9"/>
	</monster_hunt>
	<monster_hunt id="1179" start_npc_ids="203158">
		<monster var="0" npc_ids="210343 211099 211135 211153 211960 211961" end_var="10"/>
	</monster_hunt>
	<monster_hunt id="1181" start_npc_ids="203147">
		<monster var="0" npc_ids="210176" end_var="5"/>
		<monster var="1" npc_ids="210166" end_var="5"/>
	</monster_hunt>
	<monster_hunt id="1185" start_npc_ids="203178">
		<monster var="0" npc_ids="210080" end_var="6"/>
	</monster_hunt>
	<monster_hunt id="1195" start_npc_ids="203098">
		<monster var="0" npc_ids="210187" end_var="1"/>
	</monster_hunt>
	<monster_hunt id="1196" start_npc_ids="203179">
		<monster var="0" npc_ids="210086" end_var="14"/>
		<monster var="1" npc_ids="210711" end_var="8"/>
	</monster_hunt>
	<monster_hunt id="1200" start_npc_ids="203893">
		<monster var="0" npc_ids="210743" end_var="1"/>
	</monster_hunt>
	<monster_hunt id="1201" start_npc_ids="203190">
		<monster var="0" npc_ids="210268" end_var="9"/>
	</monster_hunt>
	<monster_hunt id="1202" start_npc_ids="203147">
		<monster var="0" npc_ids="210176" end_var="5"/>
		<monster var="1" npc_ids="210166" end_var="5"/>
	</monster_hunt>
	<monster_hunt id="1216" start_npc_ids="203169">
		<monster var="0" npc_ids="210112" end_var="10"/>
	</monster_hunt>
	<monster_hunt id="1217" start_npc_ids="203184">
		<monster var="0" npc_ids="210197 210085 210197" end_var="10"/>
	</monster_hunt>
	<monster_hunt id="1221" start_npc_ids="203097">
		<monster var="0" npc_ids="216913" end_var="3"/>
	</monster_hunt>
	<monster_hunt id="14111" start_npc_ids="203126">
		<monster var="0" npc_ids="210688" end_var="9"/>
		<monster var="1" npc_ids="210316" end_var="1"/>
	</monster_hunt>
</quest_scripts>